{
  "schemaVersion": 1,
  "state": "INIT",
  "enabled": true,
  "profile": "full",
  "completedSteps": [],
  "currentGate": null,
  "nextStep": "start",
  "deterministicSteps": [
    "rpd",
    "wpd",
    "visual_reference_intake",
    "design_system_derive",
    "ui_surface_inventory",
    "vd",
    "dependency_impact_audit",
    "plan_execution",
    "coverage_audit",
    "ux_audit",
    "generate_acep",
    "run_acep",
    "visual_implementation_audit"
  ],
  "humanGates": [
    "root_confirmation",
    "ui_ux_confirm",
    "implementation_scope",
    "architecture_runway",
    "review_result",
    "next_slice_decision"
  ],
  "lastUserAction": null,
  "lastFailure": null,
  "stateHistory": [],
  "downstreamOnApprove": {
    "WAITING_UI_UX_CONFIRM": [
      "visual_reference_intake",
      "design_system_derive",
      "wpd",
      "ui_surface_inventory",
      "vd",
      "dependency_impact_audit",
      "implementation_scope"
    ],
    "WAITING_IMPLEMENTATION_SCOPE": [
      "architecture_runway",
      "plan_execution",
      "coverage_audit",
      "ux_audit",
      "generate_acep",
      "run_acep",
      "visual_implementation_audit",
      "review_result"
    ],
    "SCOPE_SELECTED": [
      "plan_execution",
      "coverage_audit",
      "ux_audit",
      "generate_acep",
      "run_acep",
      "visual_implementation_audit",
      "review_result"
    ],
    "WAITING_REVIEW_RESULT": ["complete", "implementation_scope"]
  },
  "downstreamOnRevision": {
    "WAITING_UI_UX_CONFIRM": [
      "ui_ux_confirm",
      "visual_reference_intake",
      "design_system_derive",
      "wpd",
      "ui_surface_inventory",
      "vd",
      "dependency_impact_audit",
      "implementation_scope"
    ],
    "WAITING_IMPLEMENTATION_SCOPE": [
      "implementation_scope",
      "architecture_runway",
      "plan_execution",
      "coverage_audit",
      "ux_audit",
      "generate_acep",
      "run_acep",
      "visual_implementation_audit",
      "review_result"
    ],
    "SCOPE_SELECTED": [
      "architecture_runway",
      "plan_execution",
      "coverage_audit",
      "ux_audit",
      "generate_acep",
      "run_acep",
      "visual_implementation_audit",
      "review_result"
    ],
    "WAITING_REVIEW_RESULT": ["collect_feedback", "create_revision_pack", "run_revision", "review_result"]
  }
}
